{
  "result_schema_version": "0.1",
  "run_id": "qnb-v0-1-minimal-mock-1-11111111",
  "benchmark_id": "qnb-v0-1-minimal",
  "benchmark_hash": "0000000000000000000000000000000000000000000000000000000000000000",
  "execution_hash": "1111111111111111111111111111111111111111111111111111111111111111",
  "qnetbench_version": "0.0.0.dev0",
  "adapter_name": "mock",
  "adapter_version": "0.1",
  "backend_name": "mock",
  "backend_version": "0.1",
  "seed": 1,
  "status": "complete",
  "started_at_utc": "2026-07-19T00:00:00Z",
  "ended_at_utc": "2026-07-19T00:00:01Z",
  "measurement_start_s": 0.0,
  "measurement_end_s": 1.0,
  "expected_request_count": 2,
  "written_request_count": 2,
  "python_version": "3.12.13",
  "platform": "example",
  "warnings": [],
  "support_report_digest": "supported"
}
